Viloyat,Savol,O'rtacha baho
Toshkent shahri,Muassasadagi ta’lim jarayonini tashkil etishda rahbariyat tomonidan amalga oshirilayotgan ishlarni qanday baholaysiz?,3.5000000000000000
Toshkent shahri,Muassasadagi o‘qituvchilar tomonidan farzandingizga berilayotgan ta’lim sifatiga baho bering.,2.0000000000000000
Toshkent shahri,Muassasada farzandingizni ta’lim-tarbiya olishi uchun yaratilgan shart-sharoitlarga baho bering,4.0000000000000000
Toshkent shahri,Muassasada tashkil etilgan fan va sport to‘garak mashg‘ulotlari samaradorligi (natijadorligi)ni baholang,2.0000000000000000
Toshkent shahri,Farzandingizga muassasada berilayotgan ta’lim sifatiga umumiy va yakuniy baho bering,3.5000000000000000
